{
  "$schema": "../Schemas/towns.schema.json",
  "minStartingPopulation": 100,
  "maxStartingPopulation": 500,
  "maxPopulation": 10000,
  "demandPerNeedPerMonth": 10,
  "populationPerSatisfiedNeed": 20,
  "passengersPerPopulationUnit": 400,
  "mailPerPopulationUnit": 1000,
  "passengerWaitingCapacity": 50,
  "minTownsPerNeededCargo": 3,
  "tiers": [
    { "minPopulation": 0, "level1": 3, "level2": 0, "level3": 0 },
    { "minPopulation": 800, "level1": 3, "level2": 1, "level3": 0 },
    { "minPopulation": 1500, "level1": 4, "level2": 1, "level3": 0 },
    { "minPopulation": 2200, "level1": 4, "level2": 2, "level3": 0 },
    { "minPopulation": 3000, "level1": 5, "level2": 2, "level3": 1 },
    { "minPopulation": 5000, "level1": 5, "level2": 3, "level3": 1 }
  ],
  "names": [
    "Abu Dhabi",
    "Abuja",
    "Accra",
    "Addis Ababa",
    "Algiers",
    "Amman",
    "Amsterdam",
    "Andorra la Vella",
    "Ankara",
    "Antananarivo",
    "Apia",
    "Ashgabat",
    "Asmara",
    "Astana",
    "Asuncion",
    "Athens",
    "Baghdad",
    "Baku",
    "Bamako",
    "Bangkok",
    "Bangui",
    "Banjul",
    "Basseterre",
    "Beijing",
    "Beirut",
    "Belgrade",
    "Belmopan",
    "Berlin",
    "Bern",
    "Bishkek",
    "Bissau",
    "Bogota",
    "Brasilia",
    "Bratislava",
    "Brazzaville",
    "Bridgetown",
    "Brussels",
    "Bucharest",
    "Budapest",
    "Buenos Aires",
    "Cairo",
    "Canberra",
    "Caracas",
    "Castries",
    "Chisinau",
    "Colombo",
    "Conakry",
    "Copenhagen",
    "Dakar",
    "Damascus",
    "Dhaka",
    "Dili",
    "Djibouti",
    "Dodoma",
    "Doha",
    "Dublin",
    "Dushanbe",
    "Freetown",
    "Funafuti",
    "Gaborone",
    "Georgetown",
    "Gitega",
    "Guatemala City",
    "Hanoi",
    "Harare",
    "Havana",
    "Helsinki",
    "Honiara",
    "Islamabad",
    "Jakarta",
    "Juba",
    "Kabul",
    "Kampala",
    "Kathmandu",
    "Khartoum",
    "Kigali",
    "Kingston",
    "Kingstown",
    "Kinshasa",
    "Kuala Lumpur",
    "Kuwait City",
    "Kyiv",
    "La Paz",
    "Libreville",
    "Lilongwe",
    "Lima",
    "Lisbon",
    "Ljubljana",
    "Lome",
    "London",
    "Luanda",
    "Lusaka",
    "Luxembourg",
    "Madrid",
    "Majuro",
    "Malabo",
    "Male",
    "Managua",
    "Manama",
    "Manila",
    "Maputo",
    "Maseru",
    "Mbabane",
    "Mexico City",
    "Minsk",
    "Mogadishu",
    "Monaco",
    "Monrovia",
    "Montevideo",
    "Moroni",
    "Moscow",
    "Muscat",
    "Nairobi",
    "Nassau",
    "Naypyidaw",
    "New Delhi",
    "Niamey",
    "Nicosia",
    "Nouakchott",
    "Nukualofa",
    "Oslo",
    "Ottawa",
    "Ouagadougou",
    "Palikir",
    "Panama City",
    "Paramaribo",
    "Paris",
    "Phnom Penh",
    "Podgorica",
    "Port Louis",
    "Port Moresby",
    "Port of Spain",
    "Port Vila",
    "Port-au-Prince",
    "Porto-Novo",
    "Prague",
    "Praia",
    "Pretoria",
    "Pristina",
    "Pyongyang",
    "Quito",
    "Rabat",
    "Reykjavik",
    "Riga",
    "Riyadh",
    "Rome",
    "Roseau",
    "San Jose",
    "San Marino",
    "San Salvador",
    "Sanaa",
    "Santiago",
    "Santo Domingo",
    "Sao Tome",
    "Sarajevo",
    "Seoul",
    "Singapore",
    "Skopje",
    "Sofia",
    "Stockholm",
    "Suva",
    "Taipei",
    "Tallinn",
    "Tarawa",
    "Tashkent",
    "Tbilisi",
    "Tegucigalpa",
    "Tehran",
    "Thimphu",
    "Tirana",
    "Tokyo",
    "Tripoli",
    "Tunis",
    "Ulaanbaatar",
    "Vaduz",
    "Valletta",
    "Vatican City",
    "Victoria",
    "Vienna",
    "Vientiane",
    "Vilnius",
    "Warsaw",
    "Washington",
    "Wellington",
    "Windhoek",
    "Yaounde",
    "Yerevan",
    "Zagreb"
  ]
}
